{
  "schema_id": "gait.runpack.manifest",
  "schema_version": "1.0.0",
  "created_at": "2026-02-05T00:00:00Z",
  "producer_version": "0.0.0-dev",
  "run_id": "run_demo",
  "capture_mode": "reference",
  "files": [
    { "path": "run.json", "sha256": "0000000000000000000000000000000000000000000000000000000000000000" }
  ],
  "manifest_digest": "1111111111111111111111111111111111111111111111111111111111111111"
}
